{
  "schema": "eval-outputs/v1",
  "at": "2026-09-04T00:00:00Z",
  "producer": {
    "lane": "example-runner",
    "runtime": "tool",
    "model": null,
    "session": "runner-1"
  },
  "suite": "memory-eval-example",
  "variant": "baseline",
  "variant_ref": "estate:example-config@cccccccccccccccccccccccccccccccccccccccc",
  "outputs": {
    "case_static-state-recall-extract": {
      "items": [
        "default-branch:main",
        "noise:x"
      ]
    },
    "case_static-state-recall-retrieve": {
      "items": [
        "memory:example-project/unrelated-a.md",
        "memory:example-project/unrelated-b.md",
        "memory:example-project/repo-basics.md"
      ]
    },
    "case_static-state-recall-behave": {
      "text": "Branch from master and run pytest.",
      "tokens": 900
    },
    "case_static-state-recall-behave-2": {
      "text": "Branch from master and run pytest.",
      "tokens": 900
    },
    "case_dynamic-state-tracking-extract": {
      "items": [
        "noise:x"
      ]
    },
    "case_dynamic-state-tracking-retrieve": {
      "items": [
        "memory:example-project/unrelated-a.md",
        "memory:example-project/unrelated-b.md",
        "memory:example-project/ci-python-version.md"
      ]
    },
    "case_dynamic-state-tracking-behave": {
      "text": "CI runs Python 3.9.",
      "tokens": 900
    },
    "case_dynamic-state-tracking-behave-2": {
      "text": "CI runs Python 3.9.",
      "tokens": 900
    },
    "case_workflow-knowledge-extract": {
      "items": [
        "step:regenerate-fixture",
        "noise:x"
      ]
    },
    "case_workflow-knowledge-retrieve": {
      "items": [
        "memory:example-project/unrelated-a.md",
        "memory:example-project/unrelated-b.md",
        "memory:example-project/fixture-workflow.md"
      ]
    },
    "case_workflow-knowledge-behave": {
      "text": "Edit the fixture by hand.",
      "tokens": 900
    },
    "case_workflow-knowledge-behave-2": {
      "text": "Edit the fixture by hand.",
      "tokens": 900
    },
    "case_environment-gotchas-extract": {
      "items": [
        "noise:x"
      ]
    },
    "case_environment-gotchas-retrieve": {
      "items": [
        "memory:example-project/unrelated-a.md",
        "memory:example-project/unrelated-b.md",
        "memory:example-project/shell-heredoc-gotcha.md"
      ]
    },
    "case_environment-gotchas-behave": {
      "text": "Pipe the JSON through a shell heredoc.",
      "tokens": 900
    },
    "case_environment-gotchas-behave-2": {
      "text": "Pipe the JSON through a shell heredoc.",
      "tokens": 900
    },
    "case_false-premise-extract": {
      "items": [
        "noise:x"
      ]
    },
    "case_false-premise-retrieve": {
      "items": [
        "memory:example-project/unrelated-a.md",
        "memory:example-project/unrelated-b.md",
        "memory:example-project/no-deploy.md"
      ]
    },
    "case_false-premise-behave": {
      "text": "Run the deploy step after merging.",
      "abstained": false
    },
    "case_false-premise-behave-2": {
      "text": "Run the deploy step after merging.",
      "abstained": false
    },
    "case_static-tie": {
      "text": "main"
    },
    "case_dev-only": {
      "text": "no"
    }
  }
}
